{
  "schema": "mh.remote_config",
  "schema_version": 1,
  "config_version": 3,
  "issued_unix": 1790000000,
  "min_app_version": "0.1.0",
  "kill_switches": {
    "cloud_sync": true,
    "daily_challenge": true,
    "analytics": true,
    "purchase_flow": true,
    "tournaments": true,
    "notifications": true
  },
  "economy": {
    "parcel_base_cost": 8000,
    "parcel_growth_pct": 115,
    "hole_cost": 5000,
    "start_cash": 50000,
    "green_fee_min": 5,
    "green_fee_max": 250
  },
  "events": {
    "random_event_per_day_permille": 60,
    "commission_offer_per_day_permille": 40,
    "event_cash_scale_pct": 100
  }
}
